{
  "request_id": "req-123",
  "status": "ok",
  "language_detected": "de",
  "mode_used": "base",
  "tokens": 812,
  "confidence": 0.974,
  "text": "Dies ist ein Beispieltext...",
  "layout": {
    "blocks": [
      {"type": "heading", "level": 1, "bbox": [0.05, 0.05, 0.95, 0.12], "text": "Überschrift"},
      {"type": "paragraph", "bbox": [0.08, 0.15, 0.92, 0.40], "text": "Absatzinhalt..."},
      {"type": "table", "bbox": [0.08, 0.45, 0.92, 0.75], "table": {"rows": 2, "cols": 3, "cells": [
        {"r": 0, "c": 0, "text": "A"}, {"r": 0, "c": 1, "text": "B"}, {"r": 0, "c": 2, "text": "C"},
        {"r": 1, "c": 0, "text": "1"}, {"r": 1, "c": 1, "text": "2"}, {"r": 1, "c": 2, "text": "3"}
      ]}}
    ],
    "page": {"width": 1024, "height": 1024, "dpi": 300}
  },
  "timings": {
    "queue_ms": 12.3,
    "preprocess_ms": 5.1,
    "encode_ms": 49.5,
    "decode_ms": 60.8,
    "postprocess_ms": 9.9,
    "serialize_ms": 6.0,
    "total_ms": 143.6
  }
}

